"Id","CreatedAt","RetweetCount","FavoriteCount...LikeCount","Text","UserFollowersCount","UserFriendsCount","UserVerified"
1597810114290798592,2022-11-30 04:29:51,0,0,"I think there are open source NLP models that do fairly well (Bloom from HuggingFace for one), but not at the level of GPT-3",2242,4988,0
1597810728488304640,2022-11-30 04:32:18,0,0,"Okay, now this is pretty crazy GPT-3 is trained on a massive amount of text from the internet -- which means I can talk to literally anyone I want. Here's me having a convo with a fictional group of benevolent interdimensional beings cc",194,897,0
1597812224286142464,2022-11-30 04:38:14,0,0,"Let's get roll-in into this amazing project powered with GPT-3 technology which helps you automatically generate text in whatever way you would like by just letting the AI know what type of message you want to generate . Hope this time this will be . Thanks",0,11,0
1597812248713781248,2022-11-30 04:38:20,0,0,"A new model in OpenAI's family can produce longer-form content, including poetry and rhyming songs, at a level not previously seen in the models. The ""text-davinci-003"" language model does the same tasks but requires fewe",4,30,0
1597812770119876608,2022-11-30 04:40:24,0,0,"A little message I had with OpenAI's GPT-3. About using black matter for human-to-human teleportation",492,575,0
1597814916542439424,2022-11-30 04:48:56,0,1,"I've gotten some messages asking how to get started. Forgot to mention - you need an OpenAI GPT-3 key to use the app! You can get one by signing up here",327,201,0
1597817187624189952,2022-11-30 04:57:58,0,1,"My new favorite GPT-3 prompt genre",41,90,0
1597820867362586624,2022-11-30 05:12:35,0,1,"I built this tweet thread generator using the API and GPT-3. cc",22,131,0
1597821739420950528,2022-11-30 05:16:03,0,8,"Wait wait wait, do you mean, the text highlighted in green was actually written by GPT-3? Agree with the below replies, that's unbelievable and now I don't know what to trust, did it take many attempts",154,172,0
1597821959961968640,2022-11-30 05:16:56,0,0,"The name's GPT-3.5 put some respect on my name",4413,1801,0
1597823013365329920,2022-11-30 05:21:07,1,19,"How to develop your first No Code AI application (summarization app) without coding using GPT-3 and My no nonsense guide in a thread",2071,3728,0
1597823925316210688,2022-11-30 05:24:44,0,0,"I was just starting to get my head around GPT-3's text-davinci-002, and I see OpenAI have now released text-davinci-003 ( I was blown away by the previous version, and now there's a better one. I feel a bit at a loss, to be honest",1995,1609,0
1597824366401970176,2022-11-30 05:26:29,0,0,"Working on the idea + frontend for my GPT-3 writer now Thoughts? cc: MyBot 'Make me talk like any character you like",7,39,0
1597824563999805440,2022-11-30 05:27:16,7,60,"OpenAI GPT-3.5 series of models If you’re a researcher interested in more training details of OAI API models such as text-davinci-003, text-davinci-002, code-davinci-002, check it out",6343,881,0
1597824827150172160,2022-11-30 05:28:19,1,4,"1: For the fundamentals I would skip the official onboarding videos and go straight to 's Fundamentals course (Free!, what?!) Lukas holds your hand with his typical German charm as he takes you from total beginner to quite proficient user",60,69,0
1597824828060434432,2022-11-30 05:28:19,0,0,"2: For your second step in your curriculum we’re gonna have some fun and blow your mind a bit. shows off what you can do when you combine GPT-3 and Tana to create new knowledge and structure it so you can work with it",60,69,0
1597824843076243456,2022-11-30 05:28:23,0,3,"The GPT-3 rhyming poetry collab the AI world needs right now",4413,1801,0
1597825765126868992,2022-11-30 05:32:03,0,1,"My gut says this is going to need some serious oversight before it becomes useful for teachers. Top priority would be bias. Also how do we solve the fact that GPT-3 is effectively frozen in time? Not ideal",697,1255,0
1597830020180824064,2022-11-30 05:48:57,0,1,"Use the new davinci-003 OpenAI GPT-3 model from LogSeq I’ve been getting good results",6304,2677,0
1597832055806914560,2022-11-30 05:57:03,0,0,"It's a good idea but it needs polishing, in models like gpt-3 you need to find a pattern that works for any input you give since it cannot remember things over time, specially in that web demo, for example: Responde y corrige esta pregunta: <quesiton>",54,326,0
1597832555851440128,2022-11-30 05:59:02,0,0,"Been hooked onto two GPT-3 products. and GitHub Co-Pilot. Feels like an inflection point",269,182,0
1597832646611959808,2022-11-30 05:59:23,0,1,"Generated with GPT-3 with the prompt: ""write a rap song about how AI art generated with diffusion models is the real deal despite what the haters say",737,125,0
1597832803114270720,2022-11-30 06:00:01,5,14,"All done, and off localhost ! You can play around w/ my GPT-3 writer that explains anything and everything like you're 5 (link in tweet below) -- lemme know what you think! Shoutout to",57,152,0
1597832894789160960,2022-11-30 06:00:23,0,0,"GPT-3] This post on LessWrong discusses the potential for automated fraud detection in academia using existing technology. The author argues that such a system could help reduce the prevalence of academic fraud and incr",126,8,0
1597833146409619456,2022-11-30 06:01:23,0,0,"GPT-3] This post argues that abstraction is the most important skill for understanding the world. It states that the ability to recognize and understand abstract concepts is a key factor in developing knowledge and unde",126,8,0
1597833398059503616,2022-11-30 06:02:23,0,0,"GPT-3] This post discusses the television show ""The Good Place"" and its portrayal of the ""human dilemma""-- the idea that people have difficulty making decisions that will benefit them in the long run, despite knowing wh",126,8,0
1597833694068502528,2022-11-30 06:03:33,1,2,"Hot take: Huge deep learning models (i.e GPT-3, NovelAI, DALL-E, etc) should be free and open source for anyone to self host I see more incentive in generating revenue off of the model by building services and allowing people with the resources to be able to run it on their own",434,68,0
1597834060373831680,2022-11-30 06:05:00,0,4,"I just left academia (former assistant professor of economics, teaching health economics) and I’m super glad to not have to adapt my old course to the advent of GPT-3",166,584,0
1597834638592217088,2022-11-30 06:07:18,0,3,"When I tried it, GPT-3 nailed a number of my old short answer exam essay questions on policy. To adapt I’d either have to go back to in person exams rather than take-home, or skew even more towards novel math questions",166,584,0
1597835119834062848,2022-11-30 06:09:13,0,0,"Built with GPT-3 Blog Title Generator - Write catchy headlines for your blog posts! Describe your blog content in 10-15 words and get awesome title suggestions for your blog posts. Try App",10,46,0
1597835779841355776,2022-11-30 06:11:50,0,0,"It'd be amazing to see the real data. I'd be curious what signs of GPT-3 or other AI-augmented accounts are detectable. Suspect it's not just troll farms/mean-spirited souls behind the obvious surge in fake accounts. And the reliance on DAUs versus... anything meaningful",4270,811,0
1597836034276225024,2022-11-30 06:12:51,0,3,"How to add GPT-3 API to your web app using JS Follow me if you want to see more like this and let me know if you'd like me to go more in depth",269,141,0
1597836775023865856,2022-11-30 06:15:48,0,0,"you can also make smart contract like GPT-3 with",67,126,0
1597839220370198528,2022-11-30 06:25:31,7,44,"It's OpenAI's GPT-3 with davinci-003 model. I asked it to write an excuse letter to Coinbase",85523,2383,1
1597839248509788160,2022-11-30 06:25:37,0,0,"Screenshot of a project I'm working on using the new GPT-3 model text-DaVinci-003 by OpenAI. I didn't do much in the prompt and it wrote a paragraph describing a project that doesn't exist",367,302,0
1597839386468528128,2022-11-30 06:26:10,0,0,"Seriously AI is super powerful now. People aren’t ready. You try GPT-3 davinci-003 yet? It’s way better at writing now",324,388,0
1597842192026185728,2022-11-30 06:37:19,0,0,"i helped a friend do this with GPT-3 last year for a final, they got an A. I think it's about time schools for their time wasted as payback for all the time they make us waste",1226,5002,0
1597843120917344256,2022-11-30 06:41:01,2,6,"openai's co-founder greg brockman recently had an interview with alexander wang, ceo of scale. gpt-4 is incoming. no human has ever consumed 40 tb of texts. greg says we will be talking about something else other than dalle-2 & gpt-3 in 2023. unreal",997,0,0
1597843240598007808,2022-11-30 06:41:29,2,7,"So text-davinci-003 = GPT3.5",2011,813,0
1597844051390517248,2022-11-30 06:44:43,0,1,"i helped a friend do this with GPT-3 last year for a final, they got an A. I think it's about time schools got their time wasted as payback for all the time they make us waste",1226,5002,0
1597844221775732736,2022-11-30 06:45:23,0,2,"a few links of interest: he says you will get better output if you train gpt-3 on your own writing than generic writing tools like jasper & copy because their business model doesn't allow that",997,0,0
1597844482065838080,2022-11-30 06:46:25,1,2,"They don't program it to invent citations. That's an unintended consequence. GPT-3 is a model of language. It can construct language that appears academic, but knows nothing about what's appropriate or truthful. That's what makes it both powerful and dangerous",3689,723,0
1597845077652836352,2022-11-30 06:48:47,0,0,"Today is the pre-fine-tuning day! I'm going to start by fine-tuning GPT-3 to ""understand"" a simple MySQL database that I use for 's demo. Mission: Fill a prompt-completion file manually",57,423,0
1597845364413181952,2022-11-30 06:49:56,0,0,"i think they mostly don't know what they are talking about bc they have no art background/training? this otoh does exactly what it says on the tin! the trick is GPT-3 + a defined, tested range of basic themes, if you want it consumer-proof",2102,2865,0
1597845515991142400,2022-11-30 06:50:32,0,6,"Type of guy who talks like GPT-3 and can't stop. Nobody believes he's real",438,603,0
1597847994526842880,2022-11-30 07:00:23,0,0,"GPT-3] This post discusses the need for an audit system for Artificial Intelligence (AI) to ensure safety and cooperation. It suggests that the development of AI should focus on creating a system of logic and cooperatio",126,8,0
1597849791345852416,2022-11-30 07:07:31,0,3,"And this is the response to ""Very well. Let's have a love poem, lyrical, pastoral, and expressed in the language of pure mathematics. Tensor algebra mainly, with a little topology and higher calculus, if need be. But with feeling, you understand, and in the cybernetic spirit",61,39,0
1597852180492402688,2022-11-30 07:17:01,0,1,"gpt-3 gave birth to so many new tools. this one uses gpt-3 to reply to emails. works like a charm",997,0,0
1597852848716664832,2022-11-30 07:19:40,1,0,"Hugging Face estimated that BLOOM’s training led to 25 metric tons of carbon dioxide emissions. Whilst, OpenAI’s GPT-3 and Meta’s OPT were estimated to emit more than 500 and 75 metric tons of carbon dioxide, respectively, during training",24,222,0
1597852881646129152,2022-11-30 07:19:48,0,0,"GPT-3 is Trurl’s Electronic Bard",423,445,0
1597854191732416512,2022-11-30 07:25:00,0,1,"Bullish on AI - Obviously Bearish on GPT-3 - Microsoft are involved which is always a red flag Yes, it is scarily good at times. But as a writer I can spot it a mile off. GPT-3 is like a project manager who has been on a half day SCRUM course and tries to explain agile",3597,944,0
1597854595342274560,2022-11-30 07:26:36,13,19,"OpenAI upgrades GPT-3, stunning with rhyming poetry and lyrics by via cc",6704,5391,0
1597855210906746880,2022-11-30 07:29:03,0,0,"Unlocking the Power of GPT-3: 10 Ways to Use It",29,0,0
1597855787673849856,2022-11-30 07:31:21,0,8,"How do we distinguish this from a current inscrutable AI with a GPT-3 style retroactive excuse-writing engine attached? Explanations aren't any good if they're deliberate falsehoods",365,2011,0
1597856331280834560,2022-11-30 07:33:30,0,2,"Open upgrades GPT-3, stunning with rhyming poetry and lyrics by via ThAnk U Mr",11331,13,0
1597856770084388864,2022-11-30 07:35:15,0,1,"On a related theme, AI has been doing some interesting poetry - check out this article from Ars Technica yesterday. Spooky",341,973,0
1597856924879683584,2022-11-30 07:35:52,0,1,"My timeline is equally split between ""The new GPT-3 is so impressive, will lead to a lot of cheating"" and ""I asked GPT-3 a dumb trick question and it fell for it hook, line and sinker",624,1072,0
1597857025769119744,2022-11-30 07:36:16,0,0,"OpenAI's `text-davinci-003' GPT-3 model is getting quite good in terms of generating professional , reasonable responses to specific complex context specific questions",68,437,0
1597859857872277504,2022-11-30 07:47:31,1,0,"Beyond poetry, GPT-3 still has its flaws, as some have examined in detail. While its factual accuracy has reportedly increased over time, it can still easily generate false information, limiting its applications",58587,3621,1
1597860016354365440,2022-11-30 07:48:09,0,2,"That feeling when GPT-3 can write poetry in English and you cannot",195,155,0
1597860624830431232,2022-11-30 07:50:34,1,3,"Just finished to build an AI writing assistant w/ GPT-3 & So crazy what this tool can do Here's an experiment where you can generate a whitepaper for your crypto project in seconds. (don't copy paste it for your next project though",171,220,0
1597862825061679104,2022-11-30 07:59:19,0,0,"OpenAI upgrades GPT-3, stunning with rhyming poetry and lyrics My first reaction is fear",150,273,0
1597863094415507456,2022-11-30 08:00:23,0,0,"GPT-3] This post discusses how artificial intelligence (AI) could be used to improve the experience of tabletop RPGs. Specifically, the author proposes that AI could be used to automate a game master's duties, such as k",126,8,0
1597864642868817920,2022-11-30 08:06:32,0,6,"For the time being you still need to think/work super hard for clear, concise, thought-out bullets. GPT-3 is also still bad at writing poetry (messed up rhymes and rhythm). Focusing on high info density, with students’ thinking aided by LLMs, seems like a good way to go",862,3436,0
1597864759189274624,2022-11-30 08:07:00,0,0,"OpenAI upgrades GPT-3, stunning with rhyming poetry and lyrics via",4125,1326,0
1597865086000910336,2022-11-30 08:08:18,0,2,"Fed GPT-3 drevet ‘search’ (login med Discord",17213,4355,0
1597865662596382720,2022-11-30 08:10:35,0,2,"Wow this is absolutely amazing! GPT-3 (upgraded) FTW",2180,233,0
1597866790805118976,2022-11-30 08:15:04,0,0,"There's a common mistaken belief that racism is ""the belief that one race is superior to another."" Even GPT-3 Playground makes this mistake, due to bias of its trainers",842,3,0
1597867013594124288,2022-11-30 08:15:57,0,0,"announced a new model in the family of -powered large that is reportedly capable of handling more complex instructions and producing longer-form content, like and",1502,1490,0
1597867317656162304,2022-11-30 08:17:10,0,0,"Playing around w/ GPT-3, it's insane It generated an entire story for me from just a few lines I gave it at the top -- everything in green is AI-generated. cc: bro these are scarily good",25,257,0
1597867589690327040,2022-11-30 08:18:14,1,3,"Ok holy hell GPT-3 you win. I'm off",2180,233,0
1597868115131785216,2022-11-30 08:20:20,0,10,"GPT-3 with DaVinci-003 can speak cogently about autistic burnout when asked. This surprised me — it suggests that knowledge about this condition has permeated the zeitgeist enough to be captured. It even suggested a study showing that AB may be related to inflammation",21382,2647,0
1597869838235729920,2022-11-30 08:27:11,0,0,"Against us”. GPT-3 DaVinci thinks it’s human",1,31,0
1597871210003681280,2022-11-30 08:32:38,1,4,"Hello there! Marina Trajk 's no-code learning resource ""OpenAI Bubble Tutorial"" listed on nocodejobs If you want to learn , come and check resources Pricing: Free Tools:Bubble, GPT-3",240,202,0
1597872404008939520,2022-11-30 08:37:22,1,2,"Best Summary of GPT-3 text-Davinci-003",523,1688,0
1597872525874450432,2022-11-30 08:37:51,0,1,"There loads of llm copywriting startups out there and they are every bit the Kafkaesque abomination one would expect them to be I just want to sell gpt-3 farts to the lazy, rich so I can get rich, lazily before the alpha goes away",4987,1496,0
1597872818737512448,2022-11-30 08:39:01,0,1,"Unaided 1 year. GPT-3: 11 months. GPT-4: 1 week",905,538,0
1597873095146373120,2022-11-30 08:40:07,0,1,"Just asked GPT-3 ""Create a dataset for CRM with 50 sample rows""... and it did",189,860,0
1.59787473592e+18,2022-11-30 08:46:38,93,528,"Pre-IPO dramatically scaled their content production. I'm talking over 125 new blog posts per month. 1,000 that year. paid off. The traffic growth was stoopid good. And the story behind the scale is an operational masterpiece. Buckle up peeps",678,281,0
1597875020205887488,2022-11-30 08:47:46,3,25,"In prep for my class, I asked GPT-3's text-davinci-003 model for a poem about plant quantitative genetics Should I try out a new teaching hack and let students interprete the poem to learn more about the topic",1378,678,0
1597876253888942080,2022-11-30 08:52:40,0,1,"using gpt-3",34,249,0
1597879674541342720,2022-11-30 09:06:16,0,0,"I have no idea, as I haven’t read deeper into the topic. As I understood „explainable“ references model developers primarily. The goal is to have someone be able to explain, why the AI decided to deny your CC payment, not necessarily for you to understand it",21,131,0
1597879763225427968,2022-11-30 09:06:37,0,0,"the Power of GPT-3: 10 Ways to Use It",209,169,0
1597880951551713280,2022-11-30 09:11:20,1,45,"It's going to get hard to keep justifying the cost of AI tool subscriptions when general note tools like or now have built-in GPT 3. It's starting to look like AI writing is a feature, not a product",13390,298,0
1597881304967958528,2022-11-30 09:12:44,0,0,"The ROI on using GPT-3 for experimenting with AI (NLP), is insanely good. The next year, although I expect it to be a bit tough in some areas, will be very very interesting for applied AI. Results oriented AI, will be the name of the game",1384,1520,0
1597882707396235264,2022-11-30 09:18:19,1,0,"GPT-3 models achieve very strong performance in human Evaluation",1595,0,0
1597884305220722688,2022-11-30 09:24:40,4,39,"Just released - V2.1 of my free 'Low Hanging Fruit Keywords' Google Sheet powered by GPT-3! For all new features see below",12686,420,0
1597885918332956672,2022-11-30 09:31:04,0,0,"Artist feeds childhood diary into GPT-3 to have a chat with herself Article URL: Comments URL: Points: 129 # Comments: 77",1113,0,0
1597887306119401472,2022-11-30 09:36:35,2,15,"The new GPT-3 AI text model (davinci-003) is insanely good",2796,2606,0
1597887697787437056,2022-11-30 09:38:09,0,0,"Artist feeds childhood diary into GPT-3 to have a chat with herself",592,1037,0
1597888797257396224,2022-11-30 09:42:31,1,5,"Holy shit. GPT-3 might put your least favourite newspaper columnist out of a job - this was its first draft",2796,2606,0
1597889707928526848,2022-11-30 09:46:08,0,0,"New GPT-3 model: text-DaVinci-003 Article URL: Comments URL: Points: 249 # Comments: 191",1113,0,0
1597890886654111744,2022-11-30 09:50:49,1,0,"Since I already know how to code with python, GPT-3 should be handy for me",138,225,0
1597893561005244416,2022-11-30 10:01:27,0,2,"We're currently building a tool, , which lowers the barrier for non-tech people to prototype gpt-3 (and other models) based apps. Hopefully able to launch some private testing period soon",592,1377,0
1597893673756561408,2022-11-30 10:01:53,0,3,"There is 0 chance that AI will be able to work with minimal input from man, at least the way a man would like it to. You either have to guide it like a human child (forever, overtime, trial and error, updates, etc.) or it will be dumb. GPT-3 or GPT-439856745986 still dumb",2384,4995,0
1597894570951729152,2022-11-30 10:05:27,0,0,"So you're calling the GPT-3 API directly and populating a gsheet with the results",826,505,0
1597895789548044288,2022-11-30 10:10:18,0,0,"Is using GPT-3 generated writing in your own work plagiarism? I would think not, but it definitely feels that way",578,513,0
1597896509751971840,2022-11-30 10:13:10,0,3,"Check out the latest article in my newsletter: The World Cup Invented by GPT-3 via",3568,1186,0
1597896533340323840,2022-11-30 10:13:15,0,0,"this really gpt3? pretty good and surprisingly trendy",411,1517,0
1597896726748094464,2022-11-30 10:14:01,0,2,"Time to plug that into GPT-3 and let it come up with your dream interior",242,103,0
1597897393122738176,2022-11-30 10:16:40,0,0,"I keep seeing AI stuff on my feed and I feel like I missed something",257,675,0
1597897980212031488,2022-11-30 10:19:00,0,1,"Check out how easy it is to use OpenAI’s GPT-3 or DALLE engines.kids will be all over it like a rash before we catch up",1144,3137,0
1597899332946399232,2022-11-30 10:24:23,0,14,"Details on the differences between OpenAI API models. Latest available models are GPT3.5 - see",7253,67,0
1597900855058960384,2022-11-30 10:30:26,0,2,"GPT-3 an AI responds to concerns that tools like itself may write student essays",678,388,0
1597901292164501504,2022-11-30 10:32:10,0,0,"I Tested The New OpenAI GPT-3 Davinci Model",29,0,0
1597901531570876416,2022-11-30 10:33:07,0,0,"I might find GPT helpful when it's good enough that I can tell it ""Write a column in the style of Eric Crampton about X, noting Y and Z"" and it gives me something that takes only some editing instead of having to write from scratch",5633,1010,0
1597901643294867456,2022-11-30 10:33:33,0,0,"As has pointed out….search is going to die off pretty quick. GPT-3 is where it’s at and it’s going to force schools to shift quickly",1144,3137,0
1597902115866693632,2022-11-30 10:35:26,0,6,"I just entered “Write a poem about Seoul” into GPT-3 and this happened",2896,899,0
1597902457707048960,2022-11-30 10:36:48,2,3,"I Tested The New OpenAI GPT-3 Davinci Model OpenAI announced the release of a new GPT-3 model called ‘text-davinci-003’ and there are markable improvements from a generative perspective",513,0,0
1597902878315712512,2022-11-30 10:38:28,0,1,"It might be more worrying when a journo writes asking for comment on some dumb carbon subsidy/regulation thing in a sector covered by the ETS, supplies what GPT-3 says I'd say, and asks whether I'd sign off on it. AI would have plenty of training material to go from",5633,1010,0
1597903034046201856,2022-11-30 10:39:05,0,0,"The World Cup Invented by GPT-3"" على",407,5071,0
1597903576839639040,2022-11-30 10:41:14,0,0,"The one thing keeping you safe for now is the processing power/cost. I'm still stuck using GPT-2 for training real headlines/content for because can't find a free/non-coding way to do it with GPT-3. Some nerd out there probably could though :p",2796,2606,0
1597903588587884544,2022-11-30 10:41:17,0,1,"All done, and off localhost ! You can play around w/ my GPT-3 Blog writer at the link below -- lemme know what you think! Shoutout to",86,1225,0
1597905919064801280,2022-11-30 10:50:33,0,0,"It’s Exciting and Scary How Amazing GPT-3 Has Become",29,0,0
1597906545018535936,2022-11-30 10:53:02,0,0,"I Tested The New OpenAI GPT-3 Davinci Model: OpenAI announced the release of a new GPT-3 model called ‘text-davinci-003’ and there are markable improvements from a generative… Continue reading on Medium",1018,855,0
1597906851534098432,2022-11-30 10:54:15,0,0,"Musings on the future of writing (and writers) in the age of GPT-3",578,513,0
1597907547733663744,2022-11-30 10:57:01,0,0,"they don't have a moat. idk why they have raised vc funding. vc funding means ever-increasing pricing. i'm gonna bootstrap a clone forever like convertkit to compete with jasper. convertkit did with mailchimp & has insane cashflow",997,0,0
1597908273193443328,2022-11-30 10:59:54,0,2,"an account once started and run by me) is back, but is now powered by GPT-3 (text-davinci-003",36035,1155,0
1597911385538990080,2022-11-30 11:12:16,0,1,"Great work! A real, useful application of GPT-3 in quite some time",57,152,0
1597912094480863232,2022-11-30 11:15:05,0,0,"Under 2 weeks of using Yesterday, was doing some light development for my GPT-3 experiments, on my MacBook Air, soon enough, I felt the frustration for not having VSCode and Copilot available, now I have to install it on that machine too",1384,1520,0
1597912258616889344,2022-11-30 11:15:44,0,0,"Wow, I knew a lot could be done with gpt-3. I never considered this solution. Bravo , thanks for the insight",28,272,0
1597912713459650560,2022-11-30 11:17:33,1,1,"OpenAI upgrades GPT-3, stunning with rhyming poetry and lyrics: Refinement to AI language model generates rhyming compositions in various styles. On Monday, OpenAI announced a new model in the GPT-3 family of",1018,855,0
1597914472416710656,2022-11-30 11:24:32,0,0,"The text-davinci-003 model handles more complex instructions and produces longer-form content. This week OpenAI published a new generative text model. According to the organization, the… - Follow for more",9328,1818,0
1597914587948539904,2022-11-30 11:25:00,32,320,"Sounds like Jasper might be moving away from relying on OpenAI’s API by building their own models and training on Cerebras? If so, interesting! Start out w/3rd party model API to go fast, build market share, then dive down the stack to protect yourself",37442,28121,1
1597915163151470592,2022-11-30 11:27:17,0,1,"IMHO, i think that we haven't explored all the possibilities with GPT-3. i think doesn't even know all of its capabilities. one could use it to generate saas micro-services",861,821,0
