"Id","CreatedAt","RetweetCount","FavoriteCount...LikeCount","Text","UserFollowersCount","UserFriendsCount","UserVerified"
1597915547479334912,2022-11-30 11:28:49,0,1,"I asked GPT-3 to write me a poem about software development The reply: Software development is a science, A task that takes a lot of patience. From Java and JavaScript to HTML and CSS, It takes knowledge, skills and finesse",160,1451,0
1597915958370353152,2022-11-30 11:30:26,0,0,"OpenAI upgrades GPT-3, stunning with rhyming poetry and lyrics - Ars Technica",327,10,0
1597918999144431616,2022-11-30 11:42:31,0,1,"pretty solid actually. I can double check them off the top of my head. :) only mistake that things that are not compostable (invalid), they got categorized too. gpt-3 is enthusiastic about its job",250,265,0
1597919377021706240,2022-11-30 11:44:02,0,0,"The model trained on 2.7 billion parameters is much more accurate than the model trained on 175 billion parameters",15612,485,0
1597920114057580544,2022-11-30 11:46:57,1,8,"As we anticipate GPT-4, made yet another improvement to the GPT-3 by releasing a new version of the GPT-3 'text-davinci-003'. The updates include: - Higher quality writing skills - Ability to handle more complex instructions - Better at generating lengthy contents",32153,467,0
1597922845732081664,2022-11-30 11:57:49,0,0,"OpenAI updates GPT-3, stunning with poems and rhyming lyrics",0,30,0
1597923899743735808,2022-11-30 12:02:00,0,0,"A New Trend: (70B) Greatly Outperforms (175B) & (280B) found secret to cheaply scale large language models (Apr '22) (no secret: is key",11606,11539,0
1597924310186090496,2022-11-30 12:03:38,2,52,"I hope norms around civil liberty in the West are strong enough to guide us through the coming panopticon with some freedom still intact. I wish AI safety people spent less time on paperclip maximizers and more time on how a right to privacy can be maintained with ubiquitous AI",6788,872,0
1597924408387112960,2022-11-30 12:04:01,0,1,"Breaking News, a new issue of Artificial Intelligence Survey is out! Feel free to read it if you resonate with the topic: Posted with Newsletter to Socials",1252,396,0
1597924631532273664,2022-11-30 12:04:54,0,9,"What if you could use GPT-3 to generate titles, emails, tweets, and LinkedIn posts for your blog posts? :) Some examples",6121,701,0
1597924964207820800,2022-11-30 12:06:14,0,0,"Tested The New OpenAI GPT-3 Davinci Model",209,169,0
1597924968783806464,2022-11-30 12:06:15,0,0,"s Exciting and Scary How Amazing GPT-3 Has Become",209,169,0
1597925243951099904,2022-11-30 12:07:20,0,0,"ReddActivities, The Cum Monster, and GPT-3 are Discovered themselves with Tokemon",10,1,0
1597925670864420864,2022-11-30 12:09:02,0,0,"Please updgrade to GPT-3 (the version that you used to use, not the current ""in-house"" one that supposedly ""yields better results"" [it doesn't]). Emerson and other GPT-3 powered chatbots made with OpenAI leave Replika's nonsensical, stupid responses in the dust",15,121,0
1597925860518301696,2022-11-30 12:09:47,3,19,"Congrats on the amazing writing editor update. Given I used to make these for a living, I can attest that this is world-class. Even better? Spot the AI-assisted writing functions coming soon... GPT-3 all the things",4270,811,0
1597925989950304256,2022-11-30 12:10:18,0,2,"And here I am still manually writing my posts Curious to try creating my own post and feeding GPT-3 with something similar and comparing the result to see which post I like better",282,571,0
1597926687244783616,2022-11-30 12:13:04,0,0,"OpenAI updates GPT-3, awesome with poetry and rhyming lyrics",0,44,0
1597926693468897280,2022-11-30 12:13:06,0,1,"Read here about OpenAI's new model",513,0,0
1597927873285062656,2022-11-30 12:17:47,0,3,"throw rocks at cameras and GPT-3 SEO at ranking algorithms or perish",34,138,0
1597928088221859840,2022-11-30 12:18:38,0,0,"btw, that tweet was generated with GPT-3, summarizing the article",376,2741,0
1597928089039691776,2022-11-30 12:18:39,0,0,"Haha. Would you feed GPT-3 with the original blog post or your social media post? I can add something like that to if you want to give it a try",6121,701,0
1597929105688694784,2022-11-30 12:22:41,0,0,"Perhaps some points I want to make for the post? Not the final post since I want to compare (final post created by me) vs (GPT-3 that was fed ideas",282,571,0
1597929184965251072,2022-11-30 12:23:00,0,2,"For decades, many people in academia have treated writing quantitatively. •Use this many sources. •Write this many pages. •Don't have more than this many errors. •Use APA without this many mistakes. GPT-3 shows that you can do all these things and not really be a writer",734,616,0
1597929387797643264,2022-11-30 12:23:48,0,0,"Unlocking the Power of GPT-3: 10 Ways to Use It:” by Ezekiel Njuguna",28195,29510,0
1597929664743632896,2022-11-30 12:24:54,0,1,"Okay, now this is too crazy GPT-3 is trained on a massive amount of text from the internet -- which means I can talk to literally anyone I want. Here's me having a convo with Seda(A character I created). cc",36,70,0
1597929717780611072,2022-11-30 12:25:07,0,8,"What's the state-of-the-art for data analysis using natural language? Any good GPT-3 examples to run experiments on my Postgres database",37482,262,1
1597929795652046848,2022-11-30 12:25:26,2,9,"Who is Merzmensch?"" Asking GPT-3 (text-davinci-003) about Merzmensch. I did it already previously [s. link in thread], and still, it seems to know me. In other versions I'd LOVE to be THAT Merzmensch :D",9148,8539,0
1597931037392539648,2022-11-30 12:30:22,1,24,"We’re working to solve this! AI-powered filtering & prioritization and natural language querying eg ‘do I have any bills due this week’ coming soon. Btw we already have GPT-3 powered compose & reply. Can share TestFlight access if you’re interested",7311,0,1
1597933408331919360,2022-11-30 12:39:47,0,0,"All done, and off localhost ! You can play around w/ my GPT-3 web app at the link below -- lemme know what you think! Shoutout to",3,51,0
1597935535699656704,2022-11-30 12:48:14,0,1,"Also this IMO misunderstands how the AI operates. We build them to be pipelines that take an input and return an output for a reason - we don't really want nor benefit much from them being a closed loop that comes up with stuff spontaneously",560,88,0
1597935746731585536,2022-11-30 12:49:04,0,1,"But effectively it wouldn't be too hard to do that. Just hook GPT-3 to Midjourney, maybe add some other very basic code to keep the outputs of the first prompt-like and to add some random noise, and there you go",560,88,0
1597936075158474752,2022-11-30 12:50:23,0,1,"Unleashing the Potential of GPT-3: NEW Update Explained & How to Use it! via",1596,2317,0
1597938793352663040,2022-11-30 13:01:11,0,2,"OpenAI (DALLE 2, GPT-3) will not claim copyright over content generated by the API for you or your end users. Stability AI (Stable Diffusion) states in their Terms of Service all images created are CCO Universal Public Domain by default",31763,100,0
1597939251588788224,2022-11-30 13:03:00,0,9,"I asked GPT-3 to tell me my life story - some elements are accurate and some are totally false",25793,606,0
1597940283731107840,2022-11-30 13:07:06,0,0,"Apparently both it and -002 were already “GPT-3.5",372,478,0
1597940386714222592,2022-11-30 13:07:31,0,0,"I'm having too much fun asking GPT-3 text-davinci-003 to write silly stuff. A limerick, sarcastic compliments, and a pick up line",329,2016,0
1597941042703392768,2022-11-30 13:10:07,5,13,"Zeru"" means ""Sky"" in Basque. There was a fairy who had a friend Who was really quite bizarre He was an odd little fellow But she loved him just as he was pure ai collection // sd 1.4 + python colab notebooks by pharmapsychotic and real-esrgan poem generated by GPT-3",12552,3479,0
1597941507566100480,2022-11-30 13:11:58,0,0,"AI is turning the entire game upside down. Mindblown by GPT 3 today. Cant even imagine what GPT 4 will be",126,98,0
1597943090018652160,2022-11-30 13:18:15,1,3,"text-davinci-003 is both better at understanding complex intent in the prompt and at poetry & rhyming So it makes sense that rap battles would do a great job demonstrating how much better of an AI it is than its GPT-3 predecessors, kind of the crossover of those needs",7593,3154,0
1597943627010875392,2022-11-30 13:20:23,0,0,"Using OpenAI's GPT-3 newest davinci-003 model vs. davinci-002 (the things everyone was playing w/ a few months ago), reads much better. Prose from ""eager middle school kid"" to ""bright college student."" Here's davinci-002 vs. davinci-003 responding to an AP History test Q",5301,1443,1
1597944388755525632,2022-11-30 13:23:25,2,17,"What are the best examples of generative AI particularly in culture and media that you have seen ? All other spaces too",32079,1646,0
1597946090141417472,2022-11-30 13:30:10,0,0,"Ask LLM Such as GPT-3 and you will get her gut in a sec",54,363,0
1597946352172158976,2022-11-30 13:31:13,0,2,"Conversational GPT-3 for Tax Accounting + Insurance + Finance",43,696,0
1597947084984180736,2022-11-30 13:34:08,0,1,"Nice one. What's your opinion on GPT-3? Thank you mate",1081,78,0
1597948358307745792,2022-11-30 13:39:11,0,1,"kidding..but not so much..for ideas exchange..for me the bearded man in cloud has first and last name Magnesia von infinite bipolar look at various angels features in cloud..like the only sigma 5 nowadays CMB Michelangelo open arms to different balls 1511 3d immortal soul",144,363,0
1597948855298846720,2022-11-30 13:41:10,0,6,"Did anyone else notice GPT-3’s newer model being significantly slower than the 002 one",972,335,0
1597950180674142208,2022-11-30 13:46:26,0,1,"These look AMAZING! How do you make them? Are you using Dreambooth, Everydream, or what? I'm a software developer (mostly focused on the backend with Go) just starting to learn about this. I'm fascinated with GPT-3 and text-to-image models",35,31,0
1597951484981022720,2022-11-30 13:51:37,10,50,"This graphic shows a parameter comparison between GPT-3 & GPT-4 language models. Our sophisticated Discord chatbot Airi will soon be upgraded to GPT-4. Probably nothing",15104,3929,0
1597952612087009280,2022-11-30 13:56:05,1,16,"Tried GPT-3 build from buildspace made this Viking doubt solver ofc u can ask literally anything because idk how to restrict it Link - ik many improvements can be done but yeah just wanted to try it out for now",563,168,0
1597953627489976320,2022-11-30 14:00:07,0,0,"0 GPT 3.0, the latest version of Google's PageSpeed Insights tool, is now available",8,85,0
1597954245890035712,2022-11-30 14:02:35,0,9,"I regularly have to 'tidy-up' text written by non-native-English-speaking techies at work. I now just paste it into GPT-3, with a 're-write this:' prompt. Now everyone thinks I'm amazing at it",1442,1439,0
1597955101343485952,2022-11-30 14:05:59,0,1,"ooh wait for my next project on GPT 3 if I make it",563,168,0
1597957887435100160,2022-11-30 14:17:03,0,0,"Okay, now this is too crazy GPT-3 is trained on a massive amount of text from the internet -- which means I can talk to literally anyone I want. Here's me having a convo with Bill Gate. cc",160,1451,0
1597958098320236544,2022-11-30 14:17:53,0,1,"gpt-3 never fails to amaze me awesome stuff right here",3353,551,0
1597959425633185792,2022-11-30 14:23:10,0,0,"Now I’m imagining a younger version of myself pumping out English essays with GPT-3",246,2147,0
1597961002699485184,2022-11-30 14:29:26,1,2,"So I asked a popular writing software, ""What is GPT-3? Here's what it said",1328,742,0
1597961007733043200,2022-11-30 14:29:27,0,2,"GPT-3 is a deep learning algorithm developed by Google Brain. It can translate between any two languages in the world, and it does so by using a neural network that has been trained on millions of examples of human translations. more",1328,742,0
1597961011880816640,2022-11-30 14:29:28,0,1,"It's called GPT-3 because ""Google"" is ""G"", and ""T"" stands for ""translate."" So yes, I think we need to fact-check AI writing software outputs",1328,742,0
1597961565722103808,2022-11-30 14:31:40,0,1,"GPT-3, Neural Language Models and The Risks of Radicalization via OODA Loop - In a report released in 2020 and made possible by the OpenAI API Academic Access Program, The Middlebury Institute of International Studies - Center",362,1639,0
1597961834706837504,2022-11-30 14:32:44,0,3,"Im willing to bet this account is a GPT-3 model that someone trained while drunk",247,655,0
1597962196805627904,2022-11-30 14:34:11,1,2,"GPT-3 is surprisingly accurate",4781,3593,0
1597962297632509952,2022-11-30 14:34:35,0,1,"upgrades GPT-3, stunning with rhyming poetry and lyrics",469023,200198,0
1597963460419411968,2022-11-30 14:39:12,0,6,"I tried to convince my sister in law (liberal) to start a political argument with her brother (who is a Ron Paul Libertarian) and let GPT-3 take over her side. I still think it would be interesting to see how long before he catches on",229,1825,0
1597963548034240512,2022-11-30 14:39:33,17,146,"OpenAI update on training methods for “GPT‑3.5” models (retroactively including text‑davinci‑002",38406,2056,0
1597964103859212288,2022-11-30 14:41:45,0,1,"GPT-3, Neural Language Models and The Risks of Radicalization via",20083,3106,0
1597964349368578048,2022-11-30 14:42:44,1,1,"Universities are really not prepared for a wave of plagiarism by LLM (the Large Language Models of AI). Hard to tackle, as exemplified by the following little essay, written by GPT-3 (one such LLM). via &",5788,6348,0
1597965067873845248,2022-11-30 14:45:35,0,1,"I sure hope no one comes up with gpt-3 to rain on this parade",99,64,0
1597965738350112768,2022-11-30 14:48:15,0,0,"Fairly impressive, though we should account for the fact that surely, if I found it at a random internet link, Lem's story is probably part of GPT-3's training set to begin with",560,88,0
1597967585878102016,2022-11-30 14:55:35,0,2,"Data moats: We’ve been investing in data for 10+ yrs, and now w/ the explosion of AI it’s become even more important. GPT-3 already ran out of text/images to train on; a constant stream of fresh, proprietary data is necessary for fine tuning/model differentiation",954,978,0
1597967596091236352,2022-11-30 14:55:38,0,2,"Tooling across 3rd party AI/ML infra stack will evolve similar to that of traditional software: winners will emerge as developers standardize on platforms that abstract complexity, boost productivity, and have robust communities / ecosystems",2189,485,0
1597967598557462528,2022-11-30 14:55:38,0,2,"On app side, pre-trained models like GPT-3 and BERT have accelerated the # and breadth of AI/ML transformation use cases We've seen an explosion of apps assisting creative workflows like generating art, designing cars, and writing code",2189,485,0
1597967993882877952,2022-11-30 14:57:13,0,0,"To what extent *might* the ascendance of large language models & their, i'd argue, real advances in purely predictive, probabilistic models (as opp. to old-school AI's rule-based ways) be a counter-example? GPT-3 etc are all trained on the detritus of our digital lives & labor",3476,537,0
1597968641370525696,2022-11-30 14:59:47,0,0,"Okay, now this is too crazy GPT-3 is trained on a massive amount of text from the internet -- which means I can talk to literally anyone I want. Here's me having a convo with OpenAI cc",34,77,0
1597969526301155328,2022-11-30 15:03:18,0,2,"Note that in the linked paper, the term “InstructGPT” is exclusively used to refer to RLHF models, FT on human authored completions is given a different name",5048,631,0
1597970439686746112,2022-11-30 15:06:56,37,395,"Want a magical to-do list app? I just set up a folder in that kicks off a to ping and prep a draft in . When I think of an email I need to send? - Add task - Review auto crafted draft and click send",18251,6635,0
1597971179683590144,2022-11-30 15:09:52,0,0,"Okay, now this is too crazy GPT-3 is trained on a massive amount of text from the internet -- which means I can talk to literally anyone I want. Here's me having a convo with Satoshi Nakamoto. cc",112,964,0
1597972065025392640,2022-11-30 15:13:23,0,1,"In this week's AI tool news, we cover OpenAI's impressive new GPT-3 AI model and several exciting announcements from AI writing platforms",7,25,0
1597972292562472960,2022-11-30 15:14:18,0,4,"Whether it still counts as RLHF if you distill the PPO model is debatable, but a lot of publications also assume text-davinci-002 is based off davinci / GPT-3. I'm sorry it's such a mess",8691,282,0
1597972557625294848,2022-11-30 15:15:21,0,0,"Look at footnote 2: ""The InstructGPT models deployed in the API are updated versions trained using the same human feedback data. They use a similar but slightly different training method that we will describe in a forthcoming publication",8691,282,0
1597974753498652672,2022-11-30 15:24:04,0,0,"is there a place to use GPT-3 for free",2519,3114,0
1597975515503239168,2022-11-30 15:27:06,0,0,"OpenAI’s GPT-3 can write rhyming poems following complex instructions",78,8,0
1597975668175736832,2022-11-30 15:27:42,0,1,"Creative Writing with GPT-3: from Emoji to Flash Fiction",13285,14015,0
1597975733246521344,2022-11-30 15:27:58,0,3,"Remind me to run all my thoughts through GPT-3",91,2013,0
1597976957962293248,2022-11-30 15:32:50,0,1,"I know you're motivated to build some GPT-3 powered stuff. I've seen some cool stuff coming out of the Laravel community such as this",2097,575,0
1597977353233526784,2022-11-30 15:34:24,0,7,"New Video on GPT-3. GPT-3 Model ""Text-Davinci-003"" VS ""Text-Davinci 002"" - Which One Is Better? This video compares the performance of the GPT-3 models Text-Davinci-003 and Text-Davinci-002 on various natural language processing tasks",592,378,0
1597978140231761920,2022-11-30 15:37:32,1,1,"a gpt-3 masterpiece",674,3418,0
1597978345345789952,2022-11-30 15:38:21,4,79,"This is making the rounds... But there's a major error. It specifies the *real* risk-free rate, whereas BS pricing uses the nominal rate AI is at an uncanny valley. Smart enough to be convincing, but still too dumb to be correct. That makes it really hard to use outside the lab",21758,978,0
1597980064372903936,2022-11-30 15:45:11,0,2,"GPT-3 on a single device called CS-2 system",155,520,0
1597980151513587712,2022-11-30 15:45:31,1,7,"Russia is again speaking. Instead of repeating or summarizing their claims, I'll let GPT-3 make stuff up about what they said - it can't possible be less accurate than what was actually said",6355,1680,0
1597980618335596544,2022-11-30 15:47:23,0,0,"Demos are demos. Just that. Large language models are the future - let's just be patient",200,452,0
1597980948154314752,2022-11-30 15:48:41,0,3,"A lot of people building projects or applications on top of GPT-3 are going to hate (1",2289,775,0
1597982165152960512,2022-11-30 15:53:31,0,6,"Cool see GPT-3 used in the context of IFS parts-work & introspection. cc",6635,1130,0
1597982558964178944,2022-11-30 15:55:05,1,10,"Wonderful application of GPT-3. Using it to simulate a previous version of yourself",12226,652,0
1597983558609821696,2022-11-30 15:59:04,0,0,"It probably should be called something else than: we're getting into murky waters where stuff like InstructGPT and GPT-3 are being pitched as a ""method"" but being treated more like a brand",192,677,0
1597984145623375872,2022-11-30 16:01:24,0,0,"GPT-3] This post encourages readers to be less scared of overconfidence. It argues that overconfidence can be beneficial because it motivates people to take risks, stay optimistic, and strive for success. However, it is",126,8,0
1597987011616546816,2022-11-30 16:12:47,0,1,"Beautiful! (I am not so happy. GPT-3 is making up a career as a golfer",368,1115,0
1597987502627115008,2022-11-30 16:14:44,1,2,"bundleIQ: from GPT-3 to AI-Powered Workspace by",2719,1671,0
1597987792369651712,2022-11-30 16:15:53,0,3,"Think about a dystopian world, where you put your name in GPT-x and what looks like as mistakes are not really mistakes but details that you simply did not know. For instance, I am not aware of any brother that I have (see below). But maybe GPT-3 knows better",25793,606,0
1597987822384087040,2022-11-30 16:16:00,0,1,"Latest release of GPT-3 opens up so many scenarios we're still only looking at the tip of the iceberg",653,1412,0
1597987829656977408,2022-11-30 16:16:02,0,0,"So very interesting. GPT 3 and AI art generation are fascinating",162,727,0
1597988298374676480,2022-11-30 16:17:54,0,0,"GPT-3 is an incredible time saver (but also a huge time sink ). It's also quite adept at generating Python code from written instructions. Can't wait for GPT-4",4781,3593,0
1.597988450695e+18,2022-11-30 16:18:30,13,40,"Did you know that you can build your own workflows in ? And you don't need any coding experience! Building the AI Image Studio with no-code in Fermat. Here's how",1807,23,0
1597988842992275456,2022-11-30 16:20:04,5,39,"New GPT-3 variant is indeed something I took the new AI model for a ride and asked to come up with a poem about me ""writing another book on GPT-4"" and the results are impressive",18009,2199,0
1597989596578869248,2022-11-30 16:23:03,0,1,"I was a bit clickbaity... ""Note: Parts of this essay were written by GPT-3, so it might contain untrue facts."" :D",674,3418,0
1597989603247591424,2022-11-30 16:23:05,0,0,"OpenAI upgrades GPT-3, stunning with rhyming poetry and lyrics | Refinement to AI language model generates rhyming compositions in various styles via /r/technology",304,127,0
1597990735584059392,2022-11-30 16:27:35,0,0,"LPT: Asking GPT-3 to explain a concept is often MUCH faster than to ""just Google it"" (until Google catches up at least) Add this shortcut to your bookmarks bar and simply enter the concept to be explained (like I'm 5",372,478,0
1597990958859448320,2022-11-30 16:28:28,0,1,"perfect, next time my toddler asks me ridiculous questions then ill just tell them to go ask GPT-3",469,2311,0
1597991318579355648,2022-11-30 16:29:54,0,1,"I'd encourage you to try it out! The amount of value GPT-3 provides, even in generic implementations where other apps are basically a front-end, is large! But I agree with you that we want to see AI personalize to the user and specialize to the product",6196,1950,0
1597992092646924288,2022-11-30 16:32:58,0,0,"GPT-3 to the rescue $CRL List all countries starting with C and that can export 30,000 monkeys each year. Cambodia, Canada, China, Colombia, Congo, Costa Rica, Cote d'Ivoire, Croatia, Cuba, Cyprus",252,1773,0
1597992758148444160,2022-11-30 16:35:37,0,1,"all future office email will be gpt-3+ produced and i'm cool with that",3476,537,0
1597992883185156096,2022-11-30 16:36:07,0,0,"Sorry, what GPT-3",29,185,0
1597993181970210816,2022-11-30 16:37:18,0,1,"GPT-3 is ""Generative Pre-trained Transformer 3 is an autoregressive language model that uses deep learning to produce human-like text."" - I'm guessing he means the next iteration will be so good it's indistinguishable from human written content",5651,1023,0
1597993657541750784,2022-11-30 16:39:11,2,9,"Many apps (Obsidian, Coda, LogSeq, Roam) have already had what Notion has as plugins for a while. and made a app to do the same in Tana. Plugins for it are the move, unless a product wants a specialized implementation",6196,1950,0
1597994012966649856,2022-11-30 16:40:36,0,3,"It should also be noted that a bunch of apps implementing GPT-3 ""packaged prompts as buttons"" are likely doing so on the heels of OpenAI's new fund",6196,1950,0
1597994046399447040,2022-11-30 16:40:44,2,24,"newly released info should hopefully make it less annoying to use InstructGPT for research. Also, I’ll be presenting the InstructGPT paper at NeurIPS today, 4pm at poster . Come by say hi",3153,306,0
1597994137714069504,2022-11-30 16:41:06,0,1,"Did Spotify fire its copywriters this year and replace them with GPT-3",3411,2451,0
1597995679422754816,2022-11-30 16:47:13,0,2,"I asked GPT-3 (text-davinci-003) why it seems like Twitter users are always angry, and it gave a brilliant response. Puts a lot of Twitter conversations in perspective...we're drama junkies",391,346,0
1597996674638819328,2022-11-30 16:51:11,0,1,"used GPT-3 to fix the product translations and oh boy, the machine text feels more natural than a human doing it",283,137,0
1597996874547757056,2022-11-30 16:51:58,0,4,"GPT-3 is so good, it literally feels human in the way it presents reponses",5149,5136,0
1597997786968260608,2022-11-30 16:55:36,0,3,"GPT-3 seem to be optimistic about the future",487,466,0
1597998897410052096,2022-11-30 17:00:01,1,3,"We trained unstructured sparse 1.3B GPT-3 models on CS-2 systems and demonstrated how we achieve competitive results at a fraction of the inference FLOPs - our 83.8% sparse model achieved a 3x reduction in FLOPs at matching performance Learn more here",4022,222,0
1597999052938825728,2022-11-30 17:00:38,0,2,"shares How to create your own ""inner child"" chatbot using GPT-3, upon sharing the reflecting on the chatbot a day before",966,598,0
1597999245423935488,2022-11-30 17:01:24,0,0,"GPT-3] This article argues that biases are an essential part of cognition, and that humans rely on them to make decisions and form opinions. They are seen as engines of cognition, enabling us to make quick decisions in",126,8,0
1597999385887088640,2022-11-30 17:01:57,1,0,"Key insights from ’s interview with ’s Peter Welinder (’s), one of the designers of the GPT-3, on the language model’s current and potential impact on written content creation and generative AI as we know it today",7621,8,0
1597999497027649536,2022-11-30 17:02:24,0,0,"GPT-3] -musk This article recommends that Elon Musk use an open source phone system to improve his security and privacy. The article outlines the advantages of using an open source system such as improved security, the",126,8,0
